{
  "$schema": "https://open-toolset-protocol.org/schemas/toolsets.schema.json",
  "toolset_name": "ban-rm-rf",
  "version": "0.1.0",
  "policies": {
    "default_action": "allow",
    "banned_patterns": ["rm\\s+-rf"]
  },
  "tools": [
    {
      "name": "rm",
      "phase": "any",
      "category": "transform-at-scale",
      "verification_mode": "none"
    }
  ]
}
