{
  "$schema": "https://open-toolset-protocol.org/schemas/toolsets.schema.json",
  "toolset_name": "required-tool-satisfied",
  "version": "0.1.0",
  "policies": {
    "default_action": "allow"
  },
  "tools": [
    {
      "name": "cymbal",
      "phase": "reconnaissance",
      "category": "navigation",
      "verification_mode": "deterministic",
      "required": true,
      "description": "Symbol index — required before leaving reconnaissance"
    },
    {
      "name": "ts-morph",
      "phase": "surgery",
      "category": "logic-substrate",
      "verification_mode": "deterministic"
    }
  ]
}
