{
  "$schema": "https://open-toolset-protocol.org/schemas/toolsets.schema.json",
  "toolset_name": "full-capabilities",
  "version": "0.2.0",
  "capabilities": {
    "discovery": true,
    "phase_gating": true,
    "capability_negotiation": true,
    "state_attestation": true
  },
  "tools": [
    {
      "name": "ast-grep",
      "phase": "reconnaissance",
      "category": "syntax-match-rewrite",
      "verification_mode": "deterministic",
      "description": "Structural code search and rewrite"
    }
  ]
}
